{
  "accounting_identity_holds": true,
  "arch": "sm_86",
  "cells": [
    {
      "app_args": [
        "--case_id",
        "dram_streaming_dot_product",
        "--timing_shape"
      ],
      "binary": "workloads/portable_lcd/ac4_mixed_long_sm80/ac4_mixed_long_sm80_run",
      "binary_present": true,
      "binary_sha256": "3a6bc3b721ce314308847c109a87aa373d71d3d1de8e7b9167bd0e910eb8d1ba",
      "resolution_status": "runnable",
      "roster_source": "portable_lcd",
      "shape_point": "timing_shape",
      "slug": "ac4_dram_streaming_dot_product"
    },
    {
      "app_args": [
        "--case_id",
        "global_atomic_histogram",
        "--timing_shape"
      ],
      "binary": "workloads/portable_lcd/ac4_mixed_long_sm80/ac4_mixed_long_sm80_run",
      "binary_present": true,
      "binary_sha256": "3a6bc3b721ce314308847c109a87aa373d71d3d1de8e7b9167bd0e910eb8d1ba",
      "resolution_status": "runnable",
      "roster_source": "portable_lcd",
      "shape_point": "timing_shape",
      "slug": "ac4_global_atomic_histogram"
    },
    {
      "app_args": [
        "--timing_shape"
      ],
      "binary": "workloads/portable_lcd/conv2d_implicit_gemm_bf16_sm80/conv2d_implicit_gemm_bf16_sm80_run",
      "binary_present": true,
      "binary_sha256": "9883fbaf8d08dee40cc5af25bf14b5afdddf17b7d0a6c1f254a91606683a4558",
      "resolution_status": "runnable",
      "roster_source": "portable_lcd",
      "shape_point": "timing_shape",
      "slug": "conv2d_implicit_gemm_bf16_sm80"
    },
    {
      "app_args": [
        "--timing_shape"
      ],
      "binary": "workloads/portable_lcd/cross_entropy_fwd_fp32_sm80/cross_entropy_fwd_fp32_sm80_run",
      "binary_present": true,
      "binary_sha256": "1ee5a2ea3e35f5b30e13f9e08c7aaa9595d7f22b8a4f0538edbe7db47618fe01",
      "resolution_status": "runnable",
      "roster_source": "portable_lcd",
      "shape_point": "timing_shape",
      "slug": "cross_entropy_fwd_fp32_sm80"
    },
    {
      "app_args": [
        "--timing_shape"
      ],
      "binary": "workloads/portable_lcd/embedding_gather_int32_sm80/embedding_gather_int32_sm80_run",
      "binary_present": true,
      "binary_sha256": "55fb08b61852bee89d102852da8a3ddf55115b38611dce0c201517112c7a2372",
      "resolution_status": "runnable",
      "roster_source": "portable_lcd",
      "shape_point": "timing_shape",
      "slug": "embedding_gather_int32_sm80"
    },
    {
      "app_args": [
        "--timing_shape"
      ],
      "binary": "workloads/portable_lcd/flash_attn_bwd_bf16_sm80/flash_attn_bwd_bf16_sm80_run",
      "binary_present": true,
      "binary_sha256": "419a658fbc47da8e4b360c4de6619329c9de84b00885818c12ca60550865acd1",
      "resolution_status": "runnable",
      "roster_source": "portable_lcd",
      "shape_point": "timing_shape",
      "slug": "flash_attn_bwd_bf16_sm80"
    },
    {
      "app_args": [
        "--timing_shape"
      ],
      "binary": "workloads/portable_lcd/flash_attn_fwd_bf16_sm80/flash_attn_fwd_bf16_sm80_run",
      "binary_present": true,
      "binary_sha256": "acaae23ed7a6705c887bbff159e0a664b941ba6df42f6bdc25b60d6c77009ce1",
      "resolution_status": "runnable",
      "roster_source": "portable_lcd",
      "shape_point": "timing_shape",
      "slug": "flash_attn_fwd_bf16_sm80"
    },
    {
      "app_args": [
        "--timing_shape"
      ],
      "binary": "workloads/portable_lcd/gemm_hmma_bf16_sm80/gemm_hmma_bf16_sm80_run",
      "binary_present": true,
      "binary_sha256": "bcf504cd975df9588e75c6726d68888a5a975950a6358b1486b60c0900627acb",
      "resolution_status": "runnable",
      "roster_source": "portable_lcd",
      "shape_point": "timing_shape",
      "slug": "gemm_hmma_bf16_sm80"
    },
    {
      "app_args": [
        "--timing_shape"
      ],
      "binary": "workloads/portable_lcd/gemm_hmma_fp16_sm80/gemm_hmma_fp16_sm80_run",
      "binary_present": true,
      "binary_sha256": "829927c7f57d7c46f0a8e51c7de6bb8c7eb7d8de1e963a33e5e9afee7839a750",
      "resolution_status": "runnable",
      "roster_source": "portable_lcd",
      "shape_point": "timing_shape",
      "slug": "gemm_hmma_fp16_sm80"
    },
    {
      "app_args": [
        "--timing_shape"
      ],
      "binary": "workloads/portable_lcd/gemm_imma_int8_sm80/gemm_imma_int8_sm80_run",
      "binary_present": true,
      "binary_sha256": "44b362cf4d503e1eb4b2791046d2084288b12fc1fc7fde9674a6d538a4b16e4a",
      "resolution_status": "runnable",
      "roster_source": "portable_lcd",
      "shape_point": "timing_shape",
      "slug": "gemm_imma_int8_sm80"
    },
    {
      "app_args": [
        "--timing_shape"
      ],
      "binary": "workloads/portable_lcd/gemm_sparse_2to4_bf16_sm80/gemm_sparse_2to4_bf16_sm80_run",
      "binary_present": true,
      "binary_sha256": "abf792ec7d7e7042ca4a4c21ae611577b50b94fad5c1a6ee534b45b13a22e254",
      "resolution_status": "runnable",
      "roster_source": "portable_lcd",
      "shape_point": "timing_shape",
      "slug": "gemm_sparse_2to4_bf16_sm80"
    },
    {
      "app_args": [
        "--timing_shape"
      ],
      "binary": "workloads/portable_lcd/layernorm_fwd_bf16_sm80/layernorm_fwd_bf16_sm80_run",
      "binary_present": true,
      "binary_sha256": "edfee9f9588d72a00caf401b2d667ba3dbbb90965fe11acf4d906f7ebc1b33dc",
      "resolution_status": "runnable",
      "roster_source": "portable_lcd",
      "shape_point": "timing_shape",
      "slug": "layernorm_fwd_bf16_sm80"
    },
    {
      "app_args": [
        "--timing_shape"
      ],
      "binary": "workloads/portable_lcd/rmsnorm_bwd_bf16_sm80/rmsnorm_bwd_bf16_sm80_run",
      "binary_present": true,
      "binary_sha256": "229b653219e8186632fee1e784ff85dd4b729d59f0881f7a7e484412e2113cba",
      "resolution_status": "runnable",
      "roster_source": "portable_lcd",
      "shape_point": "timing_shape",
      "slug": "rmsnorm_bwd_bf16_sm80"
    },
    {
      "app_args": [
        "--timing_shape"
      ],
      "binary": "workloads/portable_lcd/rmsnorm_fwd_bf16_sm80/rmsnorm_fwd_bf16_sm80_run",
      "binary_present": true,
      "binary_sha256": "2897b18afbd4eafdb517abe9764376697535b2251f69cc4d2fea34461849c4d4",
      "resolution_status": "runnable",
      "roster_source": "portable_lcd",
      "shape_point": "timing_shape",
      "slug": "rmsnorm_fwd_bf16_sm80"
    },
    {
      "app_args": [
        "--timing_shape"
      ],
      "binary": "workloads/portable_lcd/silu_fwd_bf16_sm80/silu_fwd_bf16_sm80_run",
      "binary_present": true,
      "binary_sha256": "48d65e6fda1322f0a6a2f4d4ca67a5ef74c587cf373b52d6acc676288eacd4df",
      "resolution_status": "runnable",
      "roster_source": "portable_lcd",
      "shape_point": "timing_shape",
      "slug": "silu_fwd_bf16_sm80"
    },
    {
      "app_args": [
        "--timing_shape"
      ],
      "binary": "workloads/portable_lcd/softmax_safe_bf16_sm80/softmax_safe_bf16_sm80_run",
      "binary_present": true,
      "binary_sha256": "e798f2cb4720b46a32c19158c9ce7fc64ae670ee63787cd4fe3bb1b86f8e1782",
      "resolution_status": "runnable",
      "roster_source": "portable_lcd",
      "shape_point": "timing_shape",
      "slug": "softmax_safe_bf16_sm80"
    },
    {
      "app_args": [
        "--timing_shape"
      ],
      "binary": "workloads/portable_lcd/swiglu_fwd_bf16_sm80/swiglu_fwd_bf16_sm80_run",
      "binary_present": true,
      "binary_sha256": "a9deef77dc5c117e904770ac2f815ba5b87d9273071184a0490301797e4128d8",
      "resolution_status": "runnable",
      "roster_source": "portable_lcd",
      "shape_point": "timing_shape",
      "slug": "swiglu_fwd_bf16_sm80"
    },
    {
      "app_args": [
        "--m",
        "32",
        "--n",
        "16",
        "--k",
        "64",
        "--seed",
        "42",
        "--shape-point",
        "trace_00"
      ],
      "binary": "workloads/simbench_bw/l1/bf16_hmma_gemm_traceable/bf16_hmma_gemm_traceable_run",
      "binary_present": true,
      "binary_sha256": "cb650480384416f15585b8f54efc8e7cd59cf022257c2af862e63289e142c3c9",
      "build_input_set_sha256": "3233054fca74d39fd7672619b7e927ca066ac4f7b7eda7fa60dd0739d6acd9d1",
      "build_witness_row_sha256": "a497ee225908e9d58e9e7aeee6700f2aa5cb0f4d52fb6075facb0eba932b4237",
      "build_witness_sha256": "d577b3850f5ed04c798b1475d06cd6f29e48f857c0dc5735f923157e26cc7750",
      "resolution_status": "runnable",
      "roster_source": "simbench_bw",
      "shape_binding_kind": "generic_shape_point",
      "shape_file_sha256": "b367dafceee19d62874824b2b9d120157707e845762fd10f3e3ca1e5674eb9bc",
      "shape_point": "trace_00",
      "slug": "bf16_hmma_gemm_traceable"
    },
    {
      "app_args": [
        "--allocation-bytes",
        "1048576",
        "--shared-bytes",
        "16384",
        "--carveout-percent",
        "25",
        "--accesses",
        "256",
        "--warps",
        "32",
        "--seed",
        "42",
        "--shape-point",
        "trace_00"
      ],
      "binary": "workloads/simbench_bw/l1/carveout_sensitivity_probe/carveout_sensitivity_probe_run",
      "binary_present": true,
      "binary_sha256": "935988b22927f9a8a8249ce4d18c95833e1eabb6007a9652a5a9fa199a5741ab",
      "build_input_set_sha256": "0902ead0c1e4669201d5b89a894c868d293785d9dd5cefefdab57b4387edfab9",
      "build_witness_row_sha256": "58595c5d0bb6e119b7efde6587f265b82360b1cc5e93c540bdbb23e9e2800262",
      "build_witness_sha256": "d577b3850f5ed04c798b1475d06cd6f29e48f857c0dc5735f923157e26cc7750",
      "resolution_status": "runnable",
      "roster_source": "simbench_bw",
      "shape_binding_kind": "generic_shape_point",
      "shape_file_sha256": "b6582c4353ce239dc6eb810df01cdeb6f25d52c14fef980832412299f543a35d",
      "shape_point": "trace_00",
      "slug": "carveout_sensitivity_probe"
    },
    {
      "app_args": null,
      "binary": null,
      "binary_present": false,
      "exclusion_detail": "arch_gate=sm_90a,sm_120",
      "exclusion_reason": "arch_gate",
      "resolution_status": "excluded",